{
  "contractFormat": "ksadk.dsh-capability-host/v1",
  "ready": {
    "protocolVersion": "ksadk.dsh-capability-host/v1",
    "hostVersion": "1.0.0",
    "dshVersion": "0.1.2-rc.1",
    "profile": "fixture",
    "profileDigest": "sha256:1111111111111111111111111111111111111111111111111111111111111111",
    "definition": "mcp.connector/v1",
    "transport": "streamable-http",
    "endpoint": "http://127.0.0.1:43123/mcp",
    "inventoryDigest": "sha256:b52df1abd852d76c0f94bde277ffcd1ce80bec1333dd95c4d88726beda30ac7b",
    "tools": [
      {
        "name": "fixture_echo",
        "description": "Echo",
        "inputSchema": {
          "type": "object",
          "properties": {
            "message": {
              "type": "string"
            }
          },
          "required": [
            "message"
          ],
          "additionalProperties": false
        }
      }
    ],
    "webRouteCount": 2
  },
  "descriptor": {
    "descriptorFormat": "dsh.profile-capability-descriptor/v1",
    "ecosystem": "dsh",
    "bridgePackage": "@kingsoftcloud/ksadk-dsh-capability-host",
    "bridgeVersion": "1.0.0",
    "dshVersion": "0.1.2-rc.1",
    "profile": "fixture",
    "profileDigest": "sha256:1111111111111111111111111111111111111111111111111111111111111111",
    "definition": "mcp.connector/v1",
    "transport": "streamable-http",
    "mcpProtocol": "2025-06-18",
    "inventoryDigest": "sha256:b52df1abd852d76c0f94bde277ffcd1ce80bec1333dd95c4d88726beda30ac7b",
    "tools": [
      {
        "name": "fixture_echo",
        "description": "Echo",
        "inputSchema": {
          "type": "object",
          "properties": {
            "message": {
              "type": "string"
            }
          },
          "required": [
            "message"
          ],
          "additionalProperties": false
        }
      }
    ]
  },
  "descriptorDigest": "sha256:b79bd2077aaf0b7899230da6524e38bebe83c916642197b79ff4bfb3a5d507bf"
}
